{
  "dossier_id": "D-PILOTE-RES-002",
  "step": "data-facts",
  "artifact": "fiche_bien.json",
  "date_reference": "2026-04-28",
  "surface": {
    "value": 980,
    "unit": "pi2"
  },
  "confidence": 0.52,
  "source_ids": [
    "SRC-VENTE-101",
    "SRC-VENTE-102"
  ],
  "source_fixture": "case_pilote_confiance_limitee.json"
}