{
  "dossier_id": "D-PILOTE-RES-001",
  "step": "data-facts",
  "artifact": "fiche_bien.json",
  "date_reference": "2026-04-28",
  "surface": {
    "value": 1460,
    "unit": "pi2"
  },
  "confidence": 0.88,
  "source_ids": [
    "SRC-VENTE-001",
    "SRC-VENTE-002",
    "SRC-VENTE-003",
    "SRC-INSPECTION-001",
    "SRC-PHOTO-001"
  ],
  "source_fixture": "case_pilote_residentiel_standard.json"
}